{
  "schemaVersion": 1,
  "boxTierId": "box_99",
  "targetProfitMargin": 0.45,
  "economics": {
    "allowableCostUsd": 54.45,
    "estimatedCostUsd": 41.2,
    "remainingUsd": 13.25
  },
  "items": [
    {
      "productId": "snack_gummy_1",
      "title": "JP Fruit Gummies (Assorted)",
      "category": "Snacks",
      "quantity": 1,
      "costBasisUsd": 1.15,
      "source": {
        "url": "https://example.jp/products/123",
        "capturedAt": "2026-04-24T00:00:00Z"
      }
    }
  ]
}

